{"arm":{"arm_id":"plugin-rocmfpx-mtp-probe-passthrough-baseline-arm","decision":{"fail_closed":false,"selected_symbol_id":"_patch_speculator_probe","selected_symbol_location":{"column":1,"file":"vllm_gguf_plugin/plugin.py","line":89,"symbol_id":"_patch_speculator_probe"},"terminal":"selected"},"envelope_id":"plugin-rocmfpx-mtp-probe-passthrough-baseline-envelope","side":"plugin"},"artifact_hash":"29c7b50c4b150f74b81fa2f130492e1d5af1d015597ee6a3f6f791153bf163e6","artifact_id":"plugin-rocmfpx-mtp-probe-passthrough-baseline","comparator":{"artifact_id":"plugin-comparator-baseline","kind":"rocmfpx_model_author_fork"},"compiler_resources":{"registers_per_thread":{"reason":"Not provable from source.","value":null}},"envelope":{"architecture":"unrestricted","dtype":"float16","envelope_id":"plugin-rocmfpx-mtp-probe-passthrough-baseline-envelope","format":"Q4_0_ROCMFP4","moe":{"enabled":false,"experts":null},"mtp":{"enabled":true,"layers":null},"operation":"mtp","sharding":{"expert_parallel":1,"tensor_parallel":1},"side":"plugin"},"evidence":{"evidence":["Exact source inspection at current checkout."],"limitations":["Static source only; no runtime allocator peak measured.","Commit SHA identifies HEAD; dirty-tree changes represented in source hashes, not commit SHA.","Architecture selection absent; comparator checkout/build and target-host validation blocked."],"state":"captured"},"facts":{"allocations":[],"byte_formulas":[{"formula":"not applicable","location":{"column":1,"file":"vllm_gguf_plugin/plugin.py","line":89,"symbol_id":"_patch_speculator_probe"},"name":"probe_passthrough"}],"dispatch":[{"decision":"probe passthrough","location":{"column":1,"file":"vllm_gguf_plugin/plugin.py","line":89,"symbol_id":"_patch_speculator_probe"}}],"mapping":[{"kind":"routing","location":{"column":1,"file":"vllm_gguf_plugin/plugin.py","line":89,"symbol_id":"_patch_speculator_probe"},"mapping":"GGUF reference probe passthrough"}],"scale_flow":[{"location":{"column":1,"file":"vllm_gguf_plugin/plugin.py","line":89,"symbol_id":"_patch_speculator_probe"},"operation":"not applicable; probe passthrough only"}],"storage_reads":[{"bytes":"not applicable","kind":"speculator_probe_configuration","location":{"column":1,"file":"vllm_gguf_plugin/plugin.py","line":89,"symbol_id":"_patch_speculator_probe"}}]},"provenance":{"commit_sha":"a1c358c796742969bdf394211b3ca32053f78261","extractor_version":"phase-0b-static/0.2","repo_url":"https://github.com/randomvariable/vllm-gguf-plugin.git","source_tree_sha256":"a446ea225a49e9ace25ac38c5c663da931127e5929c2171849c1f97ca7901315","sources":{"vllm_gguf_plugin/plugin.py":"a84f3b4a557d7a74a053c68726aa1fed03fe7e82f48034f3ca90695b40e8d65a"}},"schema_version":"0B.1","semantic":{"allocations":[],"architecture":{"unrestricted":true},"route":{"action":"return (model, tokenizer, kwargs.get('vllm_speculative_config'))","predicate":"_is_gguf_reference(model)"}},"side":"plugin"}
