{
  "arm": {
    "arm_id": "plugin-rocmfpx-moe-fallback-baseline-arm",
    "decision": {
      "fail_closed": true,
      "selected_symbol_id": "_fused_moe_gguf",
      "selected_symbol_location": {
        "column": 1,
        "file": "vllm_gguf_plugin/quantization/fused_moe.py",
        "line": 36,
        "symbol_id": "_fused_moe_gguf"
      },
      "terminal": "selected"
    },
    "envelope_id": "plugin-rocmfpx-moe-fallback-baseline-envelope",
    "side": "plugin"
  },
  "artifact_hash": "44614663434a7db39cdda422710eea7644570aa7b36c9c592b5139f57867574c",
  "artifact_id": "plugin-rocmfpx-moe-fallback-baseline",
  "comparator": {
    "artifact_id": "plugin-comparator-baseline",
    "kind": "rocmfpx_model_author_fork"
  },
  "compiler_resources": {
    "registers_per_thread": {
      "reason": "Not provable from source.",
      "value": null
    }
  },
  "envelope": {
    "architecture": "unrestricted",
    "dtype": "float16",
    "envelope_id": "plugin-rocmfpx-moe-fallback-baseline-envelope",
    "format": "Q4_0_ROCMFP4",
    "moe": {
      "enabled": true,
      "experts": null
    },
    "mtp": {
      "enabled": false,
      "layers": null
    },
    "operation": "moe",
    "sharding": {
      "expert_parallel": 1,
      "tensor_parallel": 1
    },
    "side": "plugin"
  },
  "evidence": {
    "evidence": [
      "Exact source inspection at current checkout."
    ],
    "limitations": [
      "Static source only; no runtime allocator peak measured.",
      "Commit SHA identifies HEAD; dirty-tree changes represented in source hashes, not commit SHA.",
      "Architecture selection absent; comparator checkout/build and target-host validation blocked."
    ],
    "state": "captured"
  },
  "facts": {
    "allocations": [
      {
        "bytes": "M * K * sizeof(dtype)",
        "created": true,
        "kind": "dense_weight_temporary",
        "location": {
          "column": 1,
          "file": "vllm_gguf_plugin/quantization/fused_moe.py",
          "line": 183,
          "symbol_id": "_fused_moe_gguf"
        }
      },
      {
        "bytes": "M * K * sizeof(dtype)",
        "created": true,
        "kind": "dense_weight_temporary",
        "location": {
          "column": 1,
          "file": "vllm_gguf_plugin/quantization/fused_moe.py",
          "line": 185,
          "symbol_id": "_fused_moe_gguf"
        }
      }
    ],
    "byte_formulas": [
      {
        "formula": "M * ceil(K / 32) * 18",
        "location": {
          "column": 1,
          "file": "vllm_gguf_plugin/quantization/fused_moe.py",
          "line": 36,
          "symbol_id": "_fused_moe_gguf"
        },
        "name": "quantized_block_bytes"
      }
    ],
    "dispatch": [
      {
        "decision": "slow MoE fallback",
        "location": {
          "column": 1,
          "file": "vllm_gguf_plugin/quantization/fused_moe.py",
          "line": 36,
          "symbol_id": "_fused_moe_gguf"
        }
      }
    ],
    "mapping": [
      {
        "kind": "tensor_parallel",
        "location": {
          "column": 1,
          "file": "vllm_gguf_plugin/quantization/fused_moe.py",
          "line": 36,
          "symbol_id": "_fused_moe_gguf"
        },
        "mapping": "source shard mapping; no architecture selection"
      }
    ],
    "scale_flow": [
      {
        "location": {
          "column": 1,
          "file": "vllm_gguf_plugin/quantization/fused_moe.py",
          "line": 36,
          "symbol_id": "_fused_moe_gguf"
        },
        "operation": "type 100 companion scale"
      }
    ],
    "storage_reads": [
      {
        "bytes": "M * ceil(K / 32) * 16",
        "kind": "packed_weight",
        "location": {
          "column": 1,
          "file": "vllm_gguf_plugin/quantization/fused_moe.py",
          "line": 36,
          "symbol_id": "_fused_moe_gguf"
        }
      },
      {
        "bytes": "M * ceil(K / 32) * 2",
        "kind": "companion_scale",
        "location": {
          "column": 1,
          "file": "vllm_gguf_plugin/quantization/fused_moe.py",
          "line": 36,
          "symbol_id": "_fused_moe_gguf"
        }
      }
    ]
  },
  "provenance": {
    "commit_sha": "8cbcd230120a9d1eb2e3e01c2e516392574a2514",
    "extractor_version": "phase-0b-static/0.2",
    "repo_url": "https://github.com/randomvariable/vllm-gguf-plugin.git",
    "source_tree_sha256": "593961a67a8580c314bc98f5ccbab76aa437f792b96574ce13bd53cdc4438834",
    "sources": {
      "vllm_gguf_plugin/quantization/fused_moe.py": "263322376cd5ab0ab2c734003caff820ed1d58a85b54ff3c9fec925320c71222"
    }
  },
  "schema_version": "0B.1",
  "semantic": {
    "allocations": [
      {
        "classification": "dense_materialization",
        "lifetime": "one_moe_expert_evaluation",
        "location": {
          "column": 1,
          "file": "vllm_gguf_plugin/quantization/fused_moe.py",
          "line": 183,
          "symbol_id": "_fused_moe_gguf"
        }
      },
      {
        "classification": "activation",
        "lifetime": "one_moe_expert_evaluation",
        "location": {
          "column": 1,
          "file": "vllm_gguf_plugin/quantization/fused_moe.py",
          "line": 184,
          "symbol_id": "_fused_moe_gguf"
        }
      },
      {
        "classification": "dense_materialization",
        "lifetime": "one_moe_expert_evaluation",
        "location": {
          "column": 1,
          "file": "vllm_gguf_plugin/quantization/fused_moe.py",
          "line": 185,
          "symbol_id": "_fused_moe_gguf"
        }
      },
      {
        "classification": "output_accumulation",
        "lifetime": "one_token_moe_evaluation",
        "location": {
          "column": 1,
          "file": "vllm_gguf_plugin/quantization/fused_moe.py",
          "line": 189,
          "symbol_id": "_fused_moe_gguf"
        }
      }
    ],
    "architecture": {
      "unrestricted": true
    }
  },
  "side": "plugin"
}
